{
  "$schema": "../schemas/graph.schema.json",
  "schemaVersion": "1.0.0",
  "title": "Tim's Knowledge Graph",
  "generatedAt": "2026-09-04T00:00:00-04:00",
  "categories": [
    { "id": "business", "label": "Business", "color": "#63e6be" },
    { "id": "ai-tech", "label": "AI / Tech", "color": "#74c0fc" },
    { "id": "everquest", "label": "EverQuest", "color": "#ffd43b" },
    { "id": "media-closet", "label": "Media / Closet", "color": "#da77f2" },
    { "id": "automotive", "label": "Automotive", "color": "#ff8787" },
    { "id": "real-estate", "label": "Real Estate", "color": "#ffa94d" },
    { "id": "finance", "label": "Finance", "color": "#94d82d" },
    { "id": "health-fitness", "label": "Health / Fitness", "color": "#38d9a9" },
    { "id": "personal", "label": "Personal", "color": "#b197fc" }
  ],
  "sources": [
    {
      "id": "curated-seed",
      "title": "Original curated knowledge graph",
      "type": "curated",
      "location": "git:a5d72e484a1166dbb14f9f91931c60c7a509c434:graph-data.js",
      "retrievedAt": "2026-09-04T00:00:00-04:00",
      "confidence": 1,
      "authorityLevel": "owner"
    }
  ],
  "nodes": [
    { "id": "knowledge-hub", "label": "Knowledge Hub", "category": "personal", "description": "A central map for connecting ideas, interests, projects, and useful discoveries.", "sourceIds": ["curated-seed"], "timestamps": { "createdAt": "2026-09-03T23:30:41-04:00", "updatedAt": "2026-09-04T00:00:00-04:00" }, "confidence": 1, "authorityLevel": "owner" },
    { "id": "strategy", "label": "Business Strategy", "category": "business", "description": "Frameworks for priorities, positioning, execution, and sustainable growth.", "sourceIds": ["curated-seed"], "timestamps": { "createdAt": "2026-09-03T23:30:41-04:00", "updatedAt": "2026-09-04T00:00:00-04:00" }, "confidence": 1, "authorityLevel": "owner" },
    { "id": "operations", "label": "Smart Operations", "category": "business", "description": "Repeatable systems, clear workflows, and practical automation.", "sourceIds": ["curated-seed"], "timestamps": { "createdAt": "2026-09-03T23:30:41-04:00", "updatedAt": "2026-09-04T00:00:00-04:00" }, "confidence": 1, "authorityLevel": "owner" },
    { "id": "customer-insight", "label": "Customer Insight", "category": "business", "description": "Learning from customer needs, behavior, feedback, and outcomes.", "sourceIds": ["curated-seed"], "timestamps": { "createdAt": "2026-09-03T23:30:41-04:00", "updatedAt": "2026-09-04T00:00:00-04:00" }, "confidence": 1, "authorityLevel": "owner" },
    { "id": "generative-ai", "label": "Generative AI", "category": "ai-tech", "description": "Tools and techniques for creating, reasoning, and building with modern AI.", "sourceIds": ["curated-seed"], "timestamps": { "createdAt": "2026-09-03T23:30:41-04:00", "updatedAt": "2026-09-04T00:00:00-04:00" }, "confidence": 1, "authorityLevel": "owner" },
    { "id": "knowledge-systems", "label": "Knowledge Systems", "category": "ai-tech", "description": "Structures that make information easier to find, connect, and apply.", "sourceIds": ["curated-seed"], "timestamps": { "createdAt": "2026-09-03T23:30:41-04:00", "updatedAt": "2026-09-04T00:00:00-04:00" }, "confidence": 1, "authorityLevel": "owner" },
    { "id": "automation", "label": "Workflow Automation", "category": "ai-tech", "description": "Using software to reduce repetitive work and strengthen reliable processes.", "sourceIds": ["curated-seed"], "timestamps": { "createdAt": "2026-09-03T23:30:41-04:00", "updatedAt": "2026-09-04T00:00:00-04:00" }, "confidence": 1, "authorityLevel": "owner" },
    { "id": "norrath", "label": "World of Norrath", "category": "everquest", "description": "Exploration, lore, and the enduring world of EverQuest.", "sourceIds": ["curated-seed"], "timestamps": { "createdAt": "2026-09-03T23:30:41-04:00", "updatedAt": "2026-09-04T00:00:00-04:00" }, "confidence": 1, "authorityLevel": "owner" },
    { "id": "raid-strategy", "label": "Raid Strategy", "category": "everquest", "description": "Coordination, preparation, roles, and group problem-solving.", "sourceIds": ["curated-seed"], "timestamps": { "createdAt": "2026-09-03T23:30:41-04:00", "updatedAt": "2026-09-04T00:00:00-04:00" }, "confidence": 1, "authorityLevel": "owner" },
    { "id": "game-economy", "label": "Game Economy", "category": "everquest", "description": "Trading, scarcity, crafting, and value inside a virtual world.", "sourceIds": ["curated-seed"], "timestamps": { "createdAt": "2026-09-03T23:30:41-04:00", "updatedAt": "2026-09-04T00:00:00-04:00" }, "confidence": 1, "authorityLevel": "owner" },
    { "id": "media-library", "label": "Media Library", "category": "media-closet", "description": "A browsable collection of films, series, music, and memorable references.", "sourceIds": ["curated-seed"], "timestamps": { "createdAt": "2026-09-03T23:30:41-04:00", "updatedAt": "2026-09-04T00:00:00-04:00" }, "confidence": 1, "authorityLevel": "owner" },
    { "id": "wardrobe-system", "label": "Wardrobe System", "category": "media-closet", "description": "Organizing clothing by use, season, style, and versatility.", "sourceIds": ["curated-seed"], "timestamps": { "createdAt": "2026-09-03T23:30:41-04:00", "updatedAt": "2026-09-04T00:00:00-04:00" }, "confidence": 1, "authorityLevel": "owner" },
    { "id": "visual-storytelling", "label": "Visual Storytelling", "category": "media-closet", "description": "How images, styling, and sequences communicate an idea.", "sourceIds": ["curated-seed"], "timestamps": { "createdAt": "2026-09-03T23:30:41-04:00", "updatedAt": "2026-09-04T00:00:00-04:00" }, "confidence": 1, "authorityLevel": "owner" },
    { "id": "vehicle-design", "label": "Vehicle Design", "category": "automotive", "description": "The meeting point of engineering, aesthetics, usability, and identity.", "sourceIds": ["curated-seed"], "timestamps": { "createdAt": "2026-09-03T23:30:41-04:00", "updatedAt": "2026-09-04T00:00:00-04:00" }, "confidence": 1, "authorityLevel": "owner" },
    { "id": "maintenance", "label": "Preventive Maintenance", "category": "automotive", "description": "Regular care that improves reliability, safety, and long-term value.", "sourceIds": ["curated-seed"], "timestamps": { "createdAt": "2026-09-03T23:30:41-04:00", "updatedAt": "2026-09-04T00:00:00-04:00" }, "confidence": 1, "authorityLevel": "owner" },
    { "id": "future-mobility", "label": "Future Mobility", "category": "automotive", "description": "Electric vehicles, intelligent systems, and evolving transportation.", "sourceIds": ["curated-seed"], "timestamps": { "createdAt": "2026-09-03T23:30:41-04:00", "updatedAt": "2026-09-04T00:00:00-04:00" }, "confidence": 1, "authorityLevel": "owner" },
    { "id": "property-analysis", "label": "Property Analysis", "category": "real-estate", "description": "Evaluating location, condition, costs, risks, and potential.", "sourceIds": ["curated-seed"], "timestamps": { "createdAt": "2026-09-03T23:30:41-04:00", "updatedAt": "2026-09-04T00:00:00-04:00" }, "confidence": 1, "authorityLevel": "owner" },
    { "id": "home-projects", "label": "Home Projects", "category": "real-estate", "description": "Improvements that balance daily usefulness, craft, and lasting value.", "sourceIds": ["curated-seed"], "timestamps": { "createdAt": "2026-09-03T23:30:41-04:00", "updatedAt": "2026-09-04T00:00:00-04:00" }, "confidence": 1, "authorityLevel": "owner" },
    { "id": "neighborhoods", "label": "Neighborhood Patterns", "category": "real-estate", "description": "How access, community, development, and amenities shape places.", "sourceIds": ["curated-seed"], "timestamps": { "createdAt": "2026-09-03T23:30:41-04:00", "updatedAt": "2026-09-04T00:00:00-04:00" }, "confidence": 1, "authorityLevel": "owner" },
    { "id": "investing", "label": "Long-Term Investing", "category": "finance", "description": "Patient capital allocation guided by goals, evidence, and risk awareness.", "sourceIds": ["curated-seed"], "timestamps": { "createdAt": "2026-09-03T23:30:41-04:00", "updatedAt": "2026-09-04T00:00:00-04:00" }, "confidence": 1, "authorityLevel": "owner" },
    { "id": "financial-systems", "label": "Financial Systems", "category": "finance", "description": "Simple routines for planning, tracking, saving, and making decisions.", "sourceIds": ["curated-seed"], "timestamps": { "createdAt": "2026-09-03T23:30:41-04:00", "updatedAt": "2026-09-04T00:00:00-04:00" }, "confidence": 1, "authorityLevel": "owner" },
    { "id": "risk", "label": "Risk & Resilience", "category": "finance", "description": "Preparing for uncertainty with buffers, diversification, and clear tradeoffs.", "sourceIds": ["curated-seed"], "timestamps": { "createdAt": "2026-09-03T23:30:41-04:00", "updatedAt": "2026-09-04T00:00:00-04:00" }, "confidence": 1, "authorityLevel": "owner" },
    { "id": "strength", "label": "Strength Training", "category": "health-fitness", "description": "Progressive movement for capability, confidence, and durable health.", "sourceIds": ["curated-seed"], "timestamps": { "createdAt": "2026-09-03T23:30:41-04:00", "updatedAt": "2026-09-04T00:00:00-04:00" }, "confidence": 1, "authorityLevel": "owner" },
    { "id": "recovery", "label": "Recovery & Sleep", "category": "health-fitness", "description": "Rest, adaptation, and sustainable rhythms that support performance.", "sourceIds": ["curated-seed"], "timestamps": { "createdAt": "2026-09-03T23:30:41-04:00", "updatedAt": "2026-09-04T00:00:00-04:00" }, "confidence": 1, "authorityLevel": "owner" },
    { "id": "nutrition", "label": "Practical Nutrition", "category": "health-fitness", "description": "Repeatable eating habits centered on energy, balance, and consistency.", "sourceIds": ["curated-seed"], "timestamps": { "createdAt": "2026-09-03T23:30:41-04:00", "updatedAt": "2026-09-04T00:00:00-04:00" }, "confidence": 1, "authorityLevel": "owner" },